{
  "$schema": "https://json-schema.org/draft/2020-12/schema",
  "$id": "https://subsolo.invalid/schemas/1.0.0/public-media.schema.json",
  "title": "Public Media",
  "type": "object",
  "additionalProperties": false,
  "required": [
    "schema_version",
    "id",
    "type",
    "alt",
    "caption",
    "credit",
    "license",
    "derivatives"
  ],
  "properties": {
    "schema_version": {
      "const": "1.0.0"
    },
    "id": {
      "type": "string",
      "pattern": "^media_[0-9A-HJKMNP-TV-Z]{26}$"
    },
    "type": {
      "enum": [
        "imagem",
        "audio",
        "video",
        "documento",
        "grafico",
        "mapa",
        "posicao-de-xadrez"
      ]
    },
    "alt": {
      "type": "string",
      "minLength": 1
    },
    "caption": {
      "anyOf": [
        {
          "type": "string",
          "minLength": 1
        },
        {
          "type": "null"
        }
      ]
    },
    "credit": {
      "type": "string",
      "minLength": 1
    },
    "license": {
      "type": "string",
      "minLength": 1
    },
    "derivatives": {
      "type": "array",
      "minItems": 1,
      "items": {
        "type": "object",
        "additionalProperties": false,
        "required": [
          "path",
          "width",
          "height",
          "format"
        ],
        "properties": {
          "path": {
            "type": "string",
            "minLength": 1
          },
          "width": {
            "type": "integer",
            "minimum": 1
          },
          "height": {
            "type": "integer",
            "minimum": 1
          },
          "format": {
            "enum": [
              "avif",
              "webp",
              "jpeg",
              "png"
            ]
          },
          "variant": {
            "type": "string",
            "minLength": 1
          },
          "mime_type": {
            "enum": [
              "image/avif",
              "image/webp",
              "image/jpeg",
              "image/png"
            ]
          },
          "bytes": {
            "type": "integer",
            "minimum": 1
          },
          "sha256": {
            "type": "string",
            "pattern": "^[a-f0-9]{64}$"
          }
        }
      }
    }
  }
}
